odio;Son gentuza.
odio;Hombre otra retrasada que se cree que irene montero es poltica a que eres comunista?
odio;callate retrasada as si q lo eres
odio;eso va por ti que eres retrasada
odio;Confirmado, eres retrasada.
odio;Eres retrasada
odio;AAAAAA NAYARA ERES INTIL QUE HACES MIRNDOLO SI VISTE EL NOMBRE PUTA RETRASADA
odio;Eres una vergenza de retrasada mental.
odio;Como que no te gusta el pan. Eres retrasada?
odio;Qu retrasada eres Zaira por mi mareMucho izquierdismo te tiene as
odio;wow es obvio q no era para mi si ni hemos hablado eres retrasada o que
odio;Eres retrasada
odio;Pero que ridcula eres!!! ASQUEROSA!!!!! Cmo te dejan en cuadro todas las semanas. RETRASADA !!!
odio;Eres retrasada nooooo
odio;Q nivel hay en los ministerios. Pero como eres tan sumamente retrasada
odio;Menuda retrasada mental eres
odio;Tu eres retrasada !
odio;Desde luego cuando te demuestran que no tienes razn y eres retrasada te vas llorando, eh?
odio;De verdad, eres retrasada mental?
odio;que ya te he escuchado pedazo de retrasada diosss joder que pesada eres cacho perra que ya escuch
odio;T eres retrasada o qu?
odio;No somos iguales. Pero t eres una retrasada mental, ojal te ds cuenta lo que haces.
odio;Oye disculpa, acaso eres retrasada?- es que te veo super especial
odio;tu eres retrasada a secas
odio;Tu lo que eres es retrasada no ms
odio;Oye pero t eres retrasada? Segn tu que debera hacer no jugar porque va a fichar por el madrid?
odio;Tu eres retrasada?
odio;Eres retrasada o algo?, Es que te me haces super especial
odio;Te pido perdn, siempre pens que eras malintencionada, pero solo eres retrasada.
odio;Te han dicho lo de que eres joven por ser educadas y no decirte que eres retrasada, deberas dar las gracias oye
odio;Que le hace el agua al pescado...
odio;Donde dejas a mi sabandija.
odio;Donde estaba el lateral? Por la distancia en que le rematan no es totalmente culpa de Sabandija
odio;La Sabandija regalando gol
odio;Esto es todo el humor que tienes? Sabandija, pelele. Tpico del facherio
odio;Tengo transporte sabandija, pero pasa qu existe el pico y placa. Sin opcin, lame culos
odio;Compartamos la misma madre o que?
odio;Perro insolvente del demonio, lagartija infiel, sucio bastardo de mis amores, sabandija... QU HACES BESANDO A LA LISIADA!!!
odio;Me salv yo, son las ac. Quelocumplafeli sabandija. Sal!
odio;Si no veo la luna contigo, la ver pensando en ti sabandija.
odio;Sabandija
odio;Chulada de gargajo de mi sabandija
odio;Creo que comparar a un noble cuadrpedo con una sabandija no es justo
odio;Qu hp. Como cualquier sabandija inmoral ahora se da de instructora de la chorrera de los choros.... y de Chorrea tambin
odio;No hagas mas de dias a la semana, tampoco seguidos, el musculo necesita tiempo para recuperarse entre entrenamientos
odio;Claro es que la gente quiere saber que clase de sabandija uribista es usted.
odio;Por? Qu pas sabandija?
odio;Si, una sabandija abyecta.
odio;Mucha fuerza
odio;Que nos vas a meter esa SABANDIJA.Come mierda maricn HIJUEPUTA.
odio;Esooooooo, mucho nimo y un abrazillo
odio;Callate, sabandija.
odio;Igual te faltaron poquitos votos para igualarlo, sabandija.....
odio;A este Leonardo no lo quiere ni su perra madre... vaya sabandija asquerosa
odio;Pura sabandija.....unos don nadie, que no representan ni a su familia .
odio;Pero ojo, ma', tranqui, humilde, la pilcha es solo un prismaLa sabandija no es swag, la sabandija es carisma
odio;aprndete la coreo pa la prox vez sabandija
odio;As es
odio;Y lo es a tu edad
odio;"&lt;-- no barro nunca, y cuando me pongo, el sabandija de la foto se me tira arriba del escobilln, viven de joda esas bestias"
odio;SERA QUE TU CREES EL PAIS ES REPRESENTADO POR UNA SABANDIJA COMO TU, PEDAZO E MOJON, SUCIO NO TIENESp0
odio;Repugnante sabandija ladrona y aptrida
odio;El apelativo de Sabandija le caer bien.
odio;Sabandija.
odio;Dganme, por favor, estn seguros que sabandija no va a seguir saliendo todos los das en TV?
odio;Otra lakra q bien baila esta sabandija !!!!!
odio;Se me acerc un wn muy rpido pens que me iba a robar y me pare altiro a lo choriza y na que ver. Asustas al feto varn culiao desconocido
odio;contstale al Esteban grandsimo gusano
odio;Porqu quieren lavarle la cara a esa sabandija?
odio;Sabandija no tiene vergenza.
odio;te abrazo feto g
odio;Con la sabandija.
odio;"SANCHEZ ES UNA SABANDIJA TERRORISTA VERBAL; EL MPP es lo peor de la politica en Uruguay"
odio;Por favor si encuentran imgenes random con fetillo energy haganmelas llegar
odio;Cmo dijo la taylorcita la vida es una sala de clases
odio;No te has enterado de que el concierto es de mujeres que CANTAN a? Hashtag. Y esas cosas . So lerd
odio;Pero mira que son pattic/mermad/lerd/simples l fachiobreros, fachaflautas.
odio;Entre lerd est la cosa, menudo colegas tienes
odio;Otra lerd!
odio;Son la lacra del pas cobarde! Si le tuvieran que subencionar los trabajadores pocas gambas os ibais a comer! Lerd!
odio;Pos mira, no lo sabia yo. Les esperaba mas humanistas o algo as.Otro grupo al lerd-redil
odio;Hacer pintadas es de lerd.Ponga M o viva Espaistan.
odio;Tan lerd son l voxer que ni saben escribir millones, voto fcil de parte de un puado de ignorantes.
odio;Pili, no me sea lerd a!!!!!
odio;Hay much lerd, Antonio.
odio;Pasa cario...hay much lerd....
odio;Cunto lerd hay por el mundo... Madre ma qu vergenza ajena me ha dado la situacin...
odio;La lerd del da
odio;S de buena mano que tambin es la gente que es retrasada mental
odio;Inepta, corrupta y retrasada mental!
odio;Otra retrasada mental .
odio;faltaba q ponga cansancio mental y quedaba re cornuda Same gorda retrasada
odio;Definitivamente eres una retrasada mental.
odio;La gente es retrasada mental.
odio;Cada vez hay ms gente, por llamarlos educadamente, retrasada mentalas nos va todo
odio;No puedo esperar comprensin de alguien que escribe como retrasada mental! Saludos
odio;no me llamo nacho pedazo de retrasada mental
odio;hay una mongolica doun retrasada mental de primero que me cae para el culo
odio;pq en espaistn la gente es muy retrasada mental, con la boina y la pandereta siemper puesta
odio;Pero que gente retrasada mental!!
odio;Se ve que la gente es retrasada mental y ha vuelto a hacer acopio de productos marzo style
odio;Eres un autntica retrasada mental
odio;Candela la retrasada mental
odio;sospecho que marina es retrasada mental (hate)
odio;Usted es una retrasada mental sin duda alguna.Pida ayuda urgente por su bien, o siga haciendo el ridculo.Imbcil absoluta.
odio;Buenos das :45 am y ya mi mam me dijo retrasada mental, va a ser un un buen da
odio;Le dije a mi prima petrista que era una retrasada y enferma mental y ya me llam a decirme paraco boba hijueputa
odio;la gente podria simplemente no ser retrasada mental
odio;Yo pensaba que eras solo retrasada mental
odio;Candela eres ms retrasada mental que todo el equipo de campeones junto.
odio;, pero t eres retrasada mental o es que nos tomas por tontos?
odio;Ests cazando en el zoolgico con esa retrasada mental.
odio;Porq estas cosas las decide una sola persona?? (Q probablemente sea retrasada mental)
odio;Es usted retrasada mental??A seguir llorando y pataleando amiga, se os acaba el chollito y los chiringuitos.
odio;Vaya retrasada mental.
odio;como le vas a gritar eso retrasada mental
odio;Vos hartate una carretada de mierd foca retrasada mental
odio;La retrasada mental eres tu mami con tu perfil te falta madurar
odio;Sra, usted es retrasada mental de nacimiento o qued as despus de hacerse comunista?
odio;Ah, y por supuesto que tienen que pagar los caprichitos de niata retrasada mental de la menistra de igualdad.
odio;Una persona que se dice decepcionada por UP y entonces va y vota fascistas, es retrasada mental.
odio;Necesitaba poner una pelcula retrasada mental como ruido blanco y encontr la perfecta para ello: Terminator Genesys.
odio;La cara de retrasada mental que tiene mi prima no tiene nombre
odio;Me dijo, fasera y retrasada mental por defenderlo.
odio;Zurderio acomplejado mediocre y mongol, qued retratado. FinPSOE extrema izquierda comunista, es lo que es.
odio;Mucha carne para ese mongol
odio;o virgin romano vs o chad mongol vs o thad sumrio
odio;Claro, tatese MONGOL MIRADO B
odio;fiso tu cyr m dej mongol
odio;Por las webas comentas, uno es inocente hasta que se demuestre lo contrario.Terrible mongol
odio;Les sirvi de algo? Fueron campeones? Mongol
odio;Larga de ser mongol
odio;Te apura mongol
odio;No seas mongol Jexx, yo a esa edad a duras penas saba que exista Inglaterra por el Chicharito
odio;Esto hay que hacerlo viral. Que los millones vean el mongol que tenemos en el silln presidencial.
odio;Otra vez este mongol?
odio;Si el TAS tiene leche, tu vieja es virgen, mongol.
odio;Y a quien Chu le interesa si dejaste o no de seguir a la U?? Mongol
odio;Ya te disculpaste con la hija de bengoechea oe mongol,doble moral y la rctmre
odio;Si pero si el lpiz no era mongol se lo coma rapidito .
odio;Y lo dice uno, donde jugadores de su club fueron vistos con la Michel Crdenas ... A parte de es mongol.
odio;La hora del mongol ha comenzado ElImbecilDePalacio AmloLiderMundial
odio;Ese nio ya est en secundaria y no usa lapicero, slo usa lpiz mongol como su presidente...
odio;Cllate mongol ms bien deja de escoger jugadores por apariencia
odio;Ninguna JR, pero el mongol ese tiene razn.
odio;casitepreguntomongol
odio;Ya deja de pedir culo, lucio pareces mongol
odio;Pedazo mongol
odio;Para de ser mongol.
odio;Se cagaba de miedo el mongol.
odio;que clase de mongol cuestionara eso?
odio;Mongol mongol y ellos jugaron con
odio;Ni modo de aplaudirte mongol
odio;Es viernes mongol! Que no te da ni para saber el da que estamos.
odio;Cuando de Diego, Antonino y Javi Mongol descansan, numeritos tira de Pep y de ciclismo2005
odio;Escribe bien pinche mongol.
odio;Uno puede comprar ropa directamente a un diseador mongol pero no, estbamos ocultos porque dictadura.El relato sin lmites.
odio;Jajjajjajja tu no conoces esa palabra mongol
odio;mama por favor ven ya tengo mas hambre que un monje mongol
odio;Pasa tu nmero para yapearte oe mongol
odio;Eso es correcto uno peda un permiso y se diriga a la direccin del colegio a sacar punta a los lpices mongol
odio;Muvete, oe, mongol!
odio;Que hablas oe mongol?
odio;Ser que este mongol no paga impuestos?
odio;oe mongol no jodas no
odio;Que impuestos mongol de mierda si a ti te mantiene el sudor nocturno de tu vieja.
odio;Jaaa el mongol habla de pagar,anda que te cache Castillo,mongol.
odio;ERES UN MONGOL.......
odio;kkkkkkkkkk anda tipo mongol igual tu
odio;Acaso hay un denuncia de keiko contra clara Elvira ospina , una prueba ms de que eres un mongol.
odio;Oe pisa tierra mongol, el dice la verdad
odio;No era necesario demostrar a Twitter tu nivel de mongol.
odio;crtin !
odio;Crtin!
odio;Crtin irresponsable et va-t-en guerre!
odio;Crtin
odio;Crtin
odio;Cretin va
odio;crtin
odio;Esti de crtin!
odio;Vale mucho ms una buena persona mediocre en su mbito que no un cretin que sea grande en el suyo
odio;Gros criss de crtin!
odio;CRTIN!
odio;Quel crtin.
odio;quel crtin
odio;Crtin.
odio;crtin?salut
odio;Crtin
odio;Quel cretin
odio;Crtin
odio;Sal crtin
odio;Crtin
odio;Crtin
odio;Crtin...
odio;Crtin !
odio;Cretin descarado!!
odio;Crtin
odio;Crtin!
odio;Crtin.
odio;Siempre certero el Cretin.
odio;crtin
odio;Ta cause perdue crtin !
odio;Quel cretin !
odio;Crtin
odio;Crtin !
odio;Crtin
odio;Crtin +1
odio;Cretin Freud.
odio;Crtin absolu.
odio;Quel crtin !
odio;Ricky Gervais y el arte de explicar a travs de sus personajes cmo ser un integral cretin
odio;Crtin
odio;Quel crtin
odio;Crtin fini ...
odio;Crtin !
odio;Crtin.
odio;Quel crtin
odio;Quel crtin criminel !
odio;Quel crtin.
odio;Crtin !
odio;Tamamo*
odio;Crtin
odio;Crtin !
odio;Idiote, imbcile, cretin.
odio;Quel cretin ce
odio;"Leopol: vas chi$&amp; crtin"
odio;CRETIN...DEMON...F...
odio;Crtin
odio;Crtin !
odio;Quel cretin
odio;Quel cretin !
odio;Crtin.
odio;Quel crtin.
odio;Un esti de cretin
odio;quel crtin
odio;Crtin
odio;crtin inculte extraverti.
odio;Quel crtin!
odio;quel crtin
odio;Crtin
odio;Quel crtin !
odio;Quel crtin
odio;"Cmo se dice ""ranita basada"" en franais? Crtin?"
odio;Quel cretin !
odio;Un cretin.
odio;Pffff quel crtin
odio;Quel crtin
odio;Si bueno tiene como caps as que corto no es xd pero si te animas a leerlo ojal te guste y sufras igual que yo con el final
odio;espero qe Soobin se tome esto como un descanso y ojal qe no lo sufras tanto, qe solo sea como un resfriado y ya esta
odio;El caso clnico eres tu HDTRPM, mierda de porquera!!! Ojal, sufras lo indecible, por mierda!
odio;ojal acabes con una persona igual que t y sufras como un desgraciado
odio;Ojal y sufras mucho
odio;Ojal que cuando te hagan lo que me hiciste , no sufras como yo.
odio;No, no te perdono. Te odio y te deseo todo el mal y ojal sufras el doble de lo que yo sufr.
odio;Ojal no sufras los estragos de la dosis
odio;Ya se te va a borrar esa sonrisa h d p!!!!!! Ojal sufras mucho en la crcel....y despues de muerto ms
odio;ojal nunca te vayas de fake y sufras
odio;Hija de la re mierda ojala ardas en el infierno y sufras da y noche tu castigo.
odio;Ajsjsjsj no podes ser as hermana, ojal no lo sufras nunca.
odio;Ojal ojal que sufras para siempre y nunca pares de llorar
odio;Hijo de la gran puta !!! Ojala sufras toda tu vida las miserias que estas produciendo.
odio;Tu eres la cicatriz del cognio, ojal sufras las consecuencias de tus obscenidades
odio;Desde lo ms sincero de mi corazn ojal ese hombre no apague tu luz y nunca sufras lo que yo sufr con l princesa
odio;no es por ser rencorosa pero ojal sufras lo q yo sufr x ti pero a la va potencia
odio;Le huea habla de los mineros y el terremoto aun, viejo conchetumare ojala sufras sufras y sigas sufriendo viejo remil culiao
odio;Putin ojal sufras mil millones de veces.....
odio;Ojal no sufras,deprate.
odio;Sos muy fuerte, te admiro y sos muy valiente, ojal nunca sufras ningn otro abuso
odio;Ojal puedas sobrellevarlo exitosamente , pero recuerda q no hay necesidad de q sufras sola y/o en silencio
odio;ROCKSTAR CHICA HIJA DE PERRA NUNCA DEBISTE DE EXISTIR ESTUPIDA ZORRA APESTOSA OJALA SUFRAS EN EL CHINGADO INFIERNO PUTA
odio;Y ojal lo sufras ms
odio;ojal algn da sufras como hiciste sufrir esa noche
odio;Ojal se muerdan la lengua,no sufras por estas voces sin destino
odio;Pucha Yesi, ojala que no sufras tanto de esos dolores en el invierno, cuidate mucho ya
odio;Ojal q sufras para siempre y nunca pares de llorar
odio;ojal nunca sufras lo q llegue a sufrir yo por ti
odio;ojala sufras para que juguemos plato
odio;Que viejo pelotudo, ojal que lo sufras vos de alguna manera nabo.
odio;La boca castiga, ojal no sufras una desgracia igual o peor. Saludos!
odio;Ojal saques sufras astronmicas para tus erederos
odio;Ojal, ojal que sufras para siempre y nunca pares de llorar
odio;Ojal te quedes sin pene y te mueras por ser un hdp y violar a una mascota tan indefensa
odio;yo s que no se le desea la muerte a nadie pero ojal te mueras
odio;ojala mueras
odio;:33 ojal te mueras, pedazo de mierda
odio;Ojal te mueras pronto mierdaaaaaa
odio;amo a mis amigues, y vos ojal te mueras mira
odio;ojal y si te mueras
odio;Ojal que te mueras de fro
odio;Ojala te mueras alv
odio;Te odio bulgarian split squat ojal te mueras
odio;te amo Post Malone ojal tu no te mueras a las
odio;maldita mina ojal t mueras
odio;"gn sam, ojal te mueras mientrasduermes sin dolor alguno &lt;3"
odio;gn mutis dganme gn sam ojala mueras mientras dorms
odio;que mal que me cae todo el mundo si vos estas leyendo esto y no sos de mi entorno me caes mal hijo de puta ojala te mueras
odio;"Que tu pareja te diga ""ojal te mueras"" es por que bsicamente ya no te necesita o se canso de vos..."
odio;Ojal te mueras y pagues por todo lo que le hiciste.
odio;Das asco ojal te mueras
odio;perra de Bruno me caes bn mal ojal te mueras alaverga
odio;Teniendo aos yo y tu ms de , CHINGA TU PUTO PADRE CADA QUE RWSPIRES, OJAL TE MUERAS.
odio;Ojal te mueras te odio
odio;Ojal t mueras la vdd
odio;mala de mierda,,ojal te mueras
odio;hagas lo que hagas suerte y ojala no mueras
odio;Ojal que te mueras en Guitarra y Voz de Andrs Cepeda es lo ms hermoso
odio;Ojala te mueras
odio;mafioso d mirrda ojal te mueras
odio;que asco las aceitunas si te gustan las aceitunas ojal mueras
odio;Voy al catre, Putin me cago en to tus muertos, so cabron hijo de puta, ojala te mueras de algo malo y sufriendo, pedazo de maricona.
odio;OJALA TE MUERAS ARBITRO DE MIERDA
odio;NALDITO FELIX TE ODIO OJALA TE MUERAS MALDITO NIO RICO
odio;Putin, hijo de la gran puta, ojal y te mueras
odio;te odio maldito perro sol ojal mueras inutil
odio;Ojal te mueras maana Putn!
odio;ojala te mueras.
odio;Ojal Que Te Mueras x Pesado
odio;ojal mueras pobre
odio;Para qu mierda me quers con vos ac si no me das ni cinco de pelota vieja de mierda ojal te mueras de sobredosis
odio;ojal te de rabia y mueras
odio;OJALA QUE TE MUERAS QUE TODO TU MUNDO SE VAYA AL OLVIDO
odio;OJALA QUE TE MUERAS QUE TODO TU MUNDO SE VAYA AL OLVIDO
odio;Ojal que te mueras me dijiste esa noche y cerraste la puertaY no nos dimos cuenta que mi vida no es ma que ya yo te la di
odio;ojal te mueras de aburrimiento
odio;feliz cumple ojala no mueras
odio;Piera culiao ojal mueras pero no impune
odio;Aahhhhhh ensima este pelotudo se la re cuenta , ojal que te mueras Payaso fantasmita
odio;que hijo de puta vladimir putin ojala te mueras no mereces ni el agua que tomas SlavaUkraine
odio;Oh no, ojal algn valiente hroe haga una donacin para que no mueras
odio;CHAO PIERA RECULIAO, OJALA TE MUERAS MAANA BASURA DE MIERDA HIJO DE UN CONTAINER DE AXEL KAISERS
odio;ojal t mueras hijo de puta
odio;no dormi x extraarlo maldito ojala t mueras
odio;ojala q el lunes no mueras en el intento!!!
odio;Ojal que te mueras, me dijiste esa noche y cerraste la puerta.
odio;Ojal te mueras de hipotermia
odio;Te odio lgebra b, ojal te mueras
odio;Pues yo tengo hoy la casa a * el resto del invierno a ...pero...tengo lea , as que borrell, muerete...
odio;arbitro muerete
odio;como retrasado , como idiota que ers , muerete poco hombre de mierda al igual que toda familia de mierda que tienes
odio;muerete perra
odio;Putin muerete ya
odio;Muerete ctm
odio;La polica de Mayagez es tan mierda, incompetente, inservible,basura y abusan de su poder que antes de pedirle ayuda mejor murete.
odio;Yo no fallo nunca la lealtad es prioridad conmigo! A murete con los mos
odio;Muerete maldita malecha de mierda
odio;si pendejo feo muerete
odio;pero que ganas de joderme la vida por dios murete de una vez a ver si as dejas de joder por una vez en tu vida hdp
odio;Mejor si murete mana
odio;Murete, t sabes quien eres .
odio;muerete
odio;Pinche Olga te odio maldita deja a Benja en paz y muerete de una vez
odio;Este ao lleva meses y das imbcil, murete.
odio;Sarita te amo. Demetrio por favor murete (pero lejos de Sarita porque seguro lo salva tambin) PasionDeGavilanes2
odio;Murete
odio;Demetrio MUERETEPasionDeGavilanes2
odio;Infame votaste por un PS, muerete
odio;Murete ctm
odio;"Si han notado que mi nombre se puede descomponer en ""Die go"", algo as como ""muerete"" en ingls"
odio;Murete de mi beb5- msica, poemas, audio libros, ruidos de naturaleza, etc
odio;te odio covid muerete
odio;murete. mmg. huele bicho.
odio;Donde estn los que decan real hasta la murete
odio;MUERETE
odio;Que flojera pinche tarea murete
odio;no, muerete de hambre
odio;murete
odio;Lo acabo de decidir, mi murete perfecta sera despus de chingarme una bolsa gigante de takis fuego
odio;muerete lucho hijo de puta JuntaDeVecinos
odio;Maldito Miyazaki y su masoquismo de mierda pq tienes que hacer historias tan buenas muerete
odio;MUERETE
odio;Na, po muerete joven pues
odio;Wena cabeza musculo.con neurona puedes escribir tanta wea.muerete ctmre
odio;TEITTER DE LIERDA MUERETE
odio;Ya voy por mi quinto regaderazo del da, no aguanto este calor insoportable, murete calor
odio;No me digas que mueres de amor por m: Primero murete, y luego mame.
odio;Travesti pelo aejo murete y hgase un tatto y tpese la cara
odio;eso, murete
odio;UnaRolaQueDigaUnaRolaQueDigaMurete de la envidia
odio;Ya muerete porfa
odio;ERES UNA MALDIYA A TODAS LES DICES LO MISMO MUERETE
odio;muere persona q critica el uwu o el xd de vd muerete
odio;Perra murete
odio;ale me kiere muerete tu
odio;murete pq me expones as
odio;MUERETE
odio;Naci en noviembre, muerete
odio;mentira muerete porfa asi nos haces un favor a todos
odio;murete
odio;XD viejo muerete
odio;Y si no kimba murete pa la pinga
odio;Muerete.
odio;muerete
odio;JOODER BRO MUERETE YA
odio;Pitino muerete rabiando como el perro KGB group que eres. Mierda
odio;Gringo loco. Murete t. Tus mierdas no nos interesan.
odio;Pero quin es Irene Montero? Es un puto desastre, era la mujer del peor comunista que hay en Espaa
odio;Salv a su pas de la mugre comunista y asesina, un puto hroe
odio;Cllate puto comunista de mier... Ah no te creas... Te amo yisus, bsame.
odio;Loco la puta pava va de perrofla y comunista y luego paga el puto colegio
odio;Putin no es comunista. Putin es un puto comunista HDLGP.Que es otro nivel.
odio;Nacionalzame mis cojones, puto comunista!
odio;El que faltaba, el puto defraudador y condenado por ello que sigue amarrado a la poltrona. Asqueroso comunista
odio;No hay un oswald que nos haga un favor??? cada dia le tengo mas puto asco al cerdo comunista ste.
odio;Mi sueo es que el gobierno comunista chino deje de quitarme el dinero, pinche juego culero es un puto gachapon
odio;Coo un puto rojo comunista como tu
odio;So* la putamdre autocorrector de la vergo antes era comunista ahora es puto AAAAAAAAAAAAAH
odio;Estos hps creen que la gente es boba y no reconoce un puto eufemismo del comunista mayor.
odio;Ser retrasado es una enfermedad ser un puto facha fascista nazi franquista de mierda es delito
odio;Como decir que eres un puto Nazi, sin decirlo expresamente.
odio;Tambin te dejamos opinar a ti en Twitter y eres un puto nazi tarado. Esto es as
odio;Ser un puto retrasado, supongo que es requisito para ser un nazi seguidor del pattico no?
odio;Este seor es un puto nazi!!!
odio;Busca a tus verdaderos padres, puto nazi.
odio;Que pesado el puto nazi. Vete a la mierda , que no debato con fascistas. CALLA
odio;Por favor que no nos marque este puto nazi.
odio;Zozulya puto nazi va a jugar en la romareda
odio;Friendly reminder: Que Zozulya sea ucraniano no hace que deje de ser un puto nazi
odio;Manetriss haz tu magia quiero ver ese apoyo al nazi de zozulya o al puto hooligan de Sandoval
odio;Solo sabes salir con lo de nazi a la vista? Acaso le falta algo de razon? Puto bildu y putos etarras
odio;Lo que es una vergenza es que no le hayan escupido a la cara al puto nazi.
odio;En menudo jardn se ha metido. Si te sientas a gobernar con un nazi, entonces eres un puto nazi. Da igual cuando lo leas.
odio;Acertado si eres un puto nazi
odio;Pero claro, entre ser una mierda y ser un puto nazi pues siempre elijo lo primero
odio;Y t eres un puto nazi fascista
odio;Putin vendr contra este Puto NAZI
odio;LA VERDAD ES QUE EL PUTO RUSO NAZI EXISTE PORQUE LOS CAGONES DE LA OTANCriminal OTAN Europa UnionEuropeenne ONU USA LOS DEJARON CRECER
odio;Ni he pasado el COVID ni voy a ir a Ukrania.Y me ducho con agua caliente.Zozulya puto nazi.Borrell gilipollas.
odio;Es un error hombre, quiere decir que eres un puto nazi de mierda.
odio;Que es lo que a ti te gustara, puto nazi
odio;Otro puto Nazi ms! Sois una plaga imposible de aniquilar.
odio;Si odias una etnia por su presidente, si, eres un puto nazi. Fuera de aqu, basura.
odio;No, digo si la imagen es real, de que sea el puto nazi ese
odio;OJO PUTO NAZI DE MIERDA
odio;aprovecho para decir que Ghandi puto filo nazi
odio;analizando solo me hice usd, me siento un puto nazi
odio;Qu tiempos en los que Zozulya era un puto nazi... Ahora es un hroe.
odio;O sea que prefieres que te gobiernen nazis, o sea que eres nazi PUTO NAZI
odio;Callate puto troll...puto cabron....tu si que eres un nazi publicando eso.
odio;Todo el que seala a inocentes es un puto nazi..
odio;A ver si se cepillan al puto nazi y se acaba el asunto.
odio;Ni puta idea de lo que es un nazi tienes Hulio
odio;Un hijo de puta nazi.
odio;Pero no veis que es un hijo de puta Nazi? Encima acomplejado porque es feo como un culo. Si no lo querr ni su madre
odio;Hermana monster chingas tu puta ganga y Nazi Madre. Y si quieres mas hasmelo saber.
odio;Ese hijo de puta NAZI genocida que respete a las madres de los rusos
odio;Hijo de puta nazi
odio;Nazi hijo de puta
odio;Arzallus fue un nazi hijo puta que nunca ha estado mejor que donde est ahora.
odio;Me parece de puta madre lo de amenazar a este nazi, lo de los rusos es harina de otro costal.
odio;Nazi hija de mil!!!
odio;SI DICES QUE TODO ES UN PUTA MIERDA NAZI MADE IN SPAIN MENOS PODEMOS ACABAS ANTES Y NO TE CABREAS TANTO!
odio;Que puta mierda , este programa es un programa que hace apologa nazi , solo le faltaba esto
odio;Tu no has conegut a un nazi en ta puta vida, perroflauta
odio;A ver fascistas de vuestra puta basura de periodista nazi llenos de bulos esto no se lo cree nadie so nazia
odio;Puta y aqu Solorzano solo pasaba orando pir el Narco partido nazi-onal y haciendole felaciones al extraditable Alias JOH
odio;Sos una hija de mil puta. Nazi
odio;Pactar con NAZIs hijos de puta tu eres imbcil
odio;Eres un hijo de la grandisima puta nazi de mierda
odio;Eres muy nazi chica, que quieres que te diga vete a la puta mierda
odio;Hijos de puta (en realidad el nombre de tu mam no importa), nazi de mierda...
odio;Menuda hija de puta nazi ests hecha, cerda
odio;Es el puto cesar carballo negro, voy a partir el televisor
odio;negro rubio puto
