odio;Son gentuza.
no odio;flowi encontr otro
no odio;cha eun woo
no odio;estoyyy
no odio;am, mas medio litro de helado, ya tengo sueo
no odio;T amo
no odio;Me gustas. Pero pues no
no odio;Gracias Hobi por regalarnos tan bellos videos siempre
no odio;Future bkdk fam
no odio;no hay forma de q eso pase y cada vez estoy mas segura de mi decisin
no odio;YOO CONGO SUN!
no odio;Como que CR7 es V10l4D0R????? En fin, siempre me gust Messi
no odio;ya cambie todo
no odio;todo a si tiempo pasa
no odio;"hay q ver greys &lt;3"
no odio;eeee muy bieeeeennn
no odio;Hoy en Monvar habr una temp. mx. C y una min. C. El viento soplar a Km/h. Feliz Da TiempoMonvar
no odio;Hoy fui feliz
no odio;"Ahuevo &gt;"
no odio;Wey me acabo de motear y me puso bien horny
no odio;Yo paso, gracias
no odio;Igual de pequeos los dos equipos.
no odio;"Y como dijo Bad Bunny "" tu no metes cabra saramambiche "" q no se lo q significa pero te quiero coger la boca"
no odio;La regis es mi mejor amiga
no odio;Extrao el )
no odio;Mirame mal otra vez mal en el colegio y te hago un desmechado reeyna
no odio;wenas axo, como te encuentras?
no odio;Anda a dormir bro, yo estaba justo por hacerlo
no odio;Buen horario axo
no odio;Quiero conocer a Ketchup
no odio;a que me disparas un litro de chocomenta, uno de limn y otro de nuez.
no odio;Cuando la conversacin es buena y la compaa an ms, el tiempo se pasa volando
no odio;En el fondo se que no pertenezco aqu
no odio;Quien sabe capaz y se mueve las cosas solas o es el espitiru del minecraft, bueno me voy a seguir haciendo tareita
no odio;Dale bro no me digas mentiras
no odio;Ansiolticos + antidepresivos= RIP mi libido
no odio;quiero un do tattoo
no odio;Buenas buenas me presento soy Rita
no odio;saben qu, puedo hasta pensar que h en tt va a promocionar ms su lbum que en otro lado , si es como lo estoy pensando
no odio;"la noche salv todo mi da&lt;"
no odio;jeon jungkook vestido completamente de negro es superior, l es tan cool
no odio;no pulp
no odio;No creo que haya maana (hoy skdvkb). Pero pueeede que el domingo en la noche, y si no ya el lunes
no odio;Suerte mi Joaqun, seguro encuentras algo chingn
no odio;Muchas gracias. El tratamiento ayudar, tambin la inyeccin de dexa que me pusieron, pero s duele.
no odio;Buenos das hermanita espero que sea leve el ltimo da de curro de esta semana
no odio;Llevo das jugando
no odio;A escasos metros me hiciste muy feliz.
no odio;hoy fui muy feliz
no odio;tiempo d mimis buenas noches a todos
no odio;Tuker lego yaa?
no odio;Hola
no odio;"Y por mi ya te puedes ir bien alv &lt;33"
no odio;M gustas
no odio;seguro nadie ver esto pero voy a subir mi edit del cumple de beom, si quieren dejen su
no odio;Gracias Siii, es ma
no odio;Quisiera tener la suficiente confianza para poder salir en blusas de tirantes
no odio;Lo bueno que hace rato me quit el antojo de una michelada.
no odio;siiii, a Monterrey, yo digo que todos hay q irnos de roomates
no odio;Boris, gordo jalero mechero y acosador se puede ir a la chucha- esperando que renuncie. Saludos!
no odio;ya no me rallo por el mismo tema cada vez q voy de fiesta
no odio;Ya no se vayan todos alv, me fue bien en el parcial
no odio;espero que hee est bien, que est descansando y haciendo cosas que le gustan
no odio;Eso eso comprar Lu-bri-caante? Si, eso
no odio;ya, ahora pgame
no odio;por ti bb sera Batman
no odio;yoooo ebria full sociable, hice amigas
no odio;, me representa brutalmente, eh?
no odio;Verlas y disfrutarlas es un camino inmejorable. La fortuna de vivir
no odio;ahh, gracias
no odio;No te preocupes algn da saldr por lo menos la tienes en el juego
no odio;"Hora de ser un gato malo &gt;"
no odio;"""Vas a ser un supersoldado"""
no odio;ahora todo me cierra mejor
no odio;Mutis!!! Ya me regreso la motivacin, les juro que cre que regresara a ser auto destructiva
no odio;Espero que la vida no nos vuelva a cruzar
no odio;Espero q al final este todo bien, suerte Gail !
no odio;Es broma
no odio;No me digas bb Amen e Igual , Bendiciones
no odio;Con toda la actitud
no odio;Ale y yo somos mutuals y padrino me quito el follow pero yo no a el
no odio;Me haces dao pero tu piensas q no
no odio;en la verga
no odio;recien cierro valorant y voy a ponerme a dibujar a spreen
no odio;Muy de acuerdo contigo Denisse!!!
no odio;Nmms que buen da
no odio;Dammn , pues que te puede decir uno animo ? Jaja pero ya viene uno de tus fuertes la MLB y todo saldra estar bien
no odio;yo extrao hablar con hasta dormir
no odio;Buenas noches
no odio;mE ALEGRO QUE TE GUSTE
no odio;Pues luego se quejan de que se los revientan pero no aprenden
no odio;como q bajoneado? mi Gaston debe de andar pilas siempre
no odio;no voy a spoilearme el concierto que lo ir a ver. adis
no odio;unos mates cn chipa bastaran para sanarme
no odio;gentaro
no odio;"Viste el remake de ""un viernes de locos""?"
no odio;Solamente sigo que no es divertido solo huir
no odio;Te hace falta tu amorcito ah y todo sera perfecto
no odio;, algo bueno.
no odio;Das
no odio;A quien sea que este a cargo de la logstica de estos eventos iramos al cine a las AM
no odio;todos los das agradezco ese /02/2022 que me dio la oportunidad de conocerte
no odio;Loma del indio, a minutos del centro
no odio;estoy en una fiesta de quince
no odio;Solo necesitaba un nombre random, pero, ya lo consegu
no odio;Est genial esta pelcula, verdad? Buen fin de semana, gracias por seguir a nosotros
no odio;Pero bueno ya tengo mi cita para dentro de mil aos yo creo
no odio;qu hago me quedo despierto ya o me duermo otra vez
no odio;Ac es donde me doy cuenta que necesito amigas sangres moradas.
no odio;mira, Dalasito emocionado
no odio;Tener un personaje ms menso que yo y que habla conmigo aunque no tenga esquizofrenia ??
no odio;hola, soy la persona mas horny que conocers en tu vida, sgueme
no odio;a pesar de todo, termino siendo una noche muyyyy agradable
no odio;Buenas noches gente los quiero recuerden que maana se viene la boda de Alfredo dibujo y la pulga.
no odio;Haria un hilo completo diciendo las inconformidades de mis compaeros pero cuando veo pou se me quita
no odio;che yo no ver el concierto, prefiero verlo en el cine, so no me vern dar rt o tuitear hasta que regrese del cine
no odio;Yo puedo con calum
no odio;a veces lo que necesitas para salir un poquito de la tristeza es una una topochico y ver una pelcula en Disney+
no odio;s que no tiene nada que ver, pero no encontr el twit, mand mi currlum al que correo
no odio;Migren
no odio;Dios dijo compartir, as que psame todo
no odio;Gracias por acordarte que estoy en Mlaga, aqu es por la tarde Buenas tardes!!!
no odio;amo demasiado las noches, especficamente amo ponerme medias y una camisa q es veces + grande q mi talla normal para acostarme
no odio;tuve una linda noche hoy
no odio;tengo sueo
no odio;Dice que me amargo por todo
no odio;Y empieza uno con amplias posibilidades de triunfar o valer madre
no odio;Creo que se referan a ser ajonjol de todos los moles
no odio;Alguien que le diga al seor alcalde que vaya y le dispare a su trasero y deje de andar hacindolo al aire que es re peligroso
no odio;Me habl para ayudarla a decidir que usar en la boda Wenas noches
no odio;Gracias por la buena onda de siempre, Alannn
no odio;Me sali un grano en el labio y me duele
no odio;hoy compr ropa y es la mejor terapia del mundo, estoy feliz
no odio;ahora evolucione oh si
no odio;como extraaba reirme con ellas
no odio;Perdn pero es la verdad Dios te bendiga
no odio;Desde pequea tengo una dismorfia con mi cuerpo y hoy tengo tanto amor por el
no odio;te dije que nunca me ibas a agarrar de pdj
no odio;Tranquilo ranboo, est muy bien, se da a entender lo que quisiste decir
no odio;Yo he puesto una lavadora para no irme (!) y ahora viendo esto me arrepiento, malvado,
no odio;ya no me quieres, solo tienes que decirlo y no te hablo ms
no odio;mis roomies no estn, tengo casa sola, pero estoy ms sola que la casa
no odio;Yo me hice tu concierto desde Miln
no odio;"-Se cola- quiero darle una muy fuerte &gt;"
no odio;Ya sabia
no odio;Ayer com tantas cosas que ya no se que ocasiona mi dolor de estmago
no odio;Esto muy orgulloso de ti (de ustedes en realidad , s que logrars muchsimo.
no odio;esque si no es contigo no es con nadie.y si no eres t, no es nadie
no odio;descansa
no odio;muy bien ahora a mimir o si no viene el coco y te va a jalar las patas
no odio;Lo que hice fue cerrar mi cuenta,y volver a ingresar,ya envie mis predicciones
no odio;Te cuido
no odio;No saba que Jwiiver se presentaba ahora, que bien. Vine por Lee know pero que bien tambin verlos
no odio;Hoy veo a mi novio despus de una semana vamos a culi.. mentira JAJAJJA
no odio;Almenos yo estudio Y mi vida no se basa en chingaderas
no odio;Sigan a y dv con cuentas, respondan para devolver
no odio;Todava existen esas pizzas???
no odio;Pero es que me vas a regaar
no odio;Feliz cumple
no odio;hice un hilo con edits o memes ns como llamarlo pero lo subo maana
no odio;! No aceptes nada y mejor toma agua del fregadero
no odio;Entren a mi perfil jeje
no odio;Eso te iba a decir, vives en un lugar perfecto si te gusta la naturaleza
no odio;Grosero t
no odio;voy a comprarme un jeans tiro bajo para presumir mi cinturita
no odio;Que ganas de hacer videollamadas
no odio;"Me est costando un mundo, pero estoy amando cada minuto de aprender Data Science &lt;3"
no odio;Solo falta estabilidad emocional y una novia para que la persona que me gusta se de cuenta de que soy el amor de su vida
no odio;Yo: amigos, veo borroso.Gian: ve a la luz
no odio;estas despierta? si yo tambin
no odio;me siento re linda
no odio;Voy a vomitar pero primero una dedeada
no odio;Esta lloviendo y ayer lav el coche
no odio;NONO ESTUVO MUY BIEN
no odio;esta correcto ranbu
no odio;Ken Suson cutie
no odio;hola ranboo como estas
no odio;Humillarme en free fire,fornite na,para que si en el ftbol me la pelas
no odio;Gracias
no odio;Empec a ver euphoria hoy
no odio;Otro da ms que el cosplay de xiao aun no a llegado
no odio;Hola Pasaba por ac a recordar que resistir, disidir e incidir son formas de lucha. Fin del tuit.
no odio;ya esta
no odio;super difcil evitar llenarse la cabeza de pensamientos dainos y destructivos
no odio;Me alegro, enhorabuena!
no odio;Cuidado con mi flaco
no odio;hopelessly_gs , creo que ya nos seguimos, idk
no odio;Ah bueno, gracias
no odio;limpiense la mugre de las uas les cambia la vida
no odio;Ya pasamos por esta wea, Bel. nimo HBD ENTROPA
no odio;Solo quiero hacer dinero
no odio;S cay la beca
no odio;Siempre me relaja manejar cuando tengo problemas
no odio;hola ni me topas pero YOOO, a las pm
no odio;Ocupaba una llamadita con mi mejor amigo para estar mejor
no odio;Y me arrepiento demasiado por ese beso apresurado
no odio;Como te explico que no se olvidar?
no odio;Seor,
no odio;gnn a los q siguen despiertos
no odio;Si te sientes bienests bien
no odio;Pero puedes remolonear Buenos das, Loco
no odio;Hoy ser un buen dia
no odio;Ahuevo viernesito de salir a caminar de noche y toda la madrugada
no odio;me alegra que hayan llegado unos das antes del da
no odio;Hoy le dije a blanca estela que no pensaba ni estresarme ni malgeniarme por ella roud for me
no odio;t cuento por priv
no odio;El coqueteo con stickers claro que existe
no odio;Espera votar no no segundo turno antes de morrer por favor.
no odio;Ya me tienen hasta la vrg los pendejos de mi trabajo
no odio;victoria secret
no odio;hello
no odio;Ojal se cumpla nos envan fotos
no odio;*se acuesta con ella y la abraza* listo
no odio;listo, muchas gracias
no odio;ay, pues me alegro mucho de que estuvieses feliz
no odio;Soy de esas personas q le gusta decir las cosas a la cara y q le digan las cosas como son
no odio;Una pedita despus de semana de exmenes estara muy bien
no odio;ahh listo, gracias
no odio;No soy un objeto, no soy ni ser de nadie
no odio;GENIAL FELICIDADES, ojala cumplas muchos mas
no odio;oye por qu no te enamoras de mi
no odio;Maana les contesto sus tweets, descansen
no odio;s, con
no odio;Buenos das
no odio;Quiero un videito bn la verga pa invitacin a mi cumple
no odio;buenas noches
no odio;Este es mi penultimo voto del dia Voto por Deja Vu en AlbumFavoritoPop de en los LatinAMAs
no odio;si, eso fue ya el ao pasado, ahora esta bien
no odio;Muchas gracias por seguir mi trabajo. En breve estarn todas, hasta la de ayer, en YouTube. Saludos
no odio;Otro da ms sin poder dormir
no odio;Me aparecen puros videos parecidos, la verdad me parecen muy interesantes )
no odio;Muchas gracias por seguir mi trabajo. En breve estarn todas, hasta la de ayer, en YouTube. Saludos
no odio;buenas noches seores
no odio;que novedad
no odio;patraas, patraas, puras patraas, no me avergenza nada
no odio;Que bonito Me alegras el da
no odio;cambiar mi fsico pero seguir dando cringe
no odio;Nada porque a la mujer se le respeta
no odio;S igual lete los warnings primero.
no odio;Ya tengo Game Pass
no odio;oceanid
no odio;debes dejar de dormirte a mitad de la pelcula
no odio;Editar me ayuda a desestresarme
no odio;Me espera un largo fin, ojal me vaya bien
no odio;Ms tarde les seguir compartiendo Por ahora me ir a descansar, se les quiere
no odio;Es espectacular, no puedo dejar de jugar
no odio;Exigeante
no odio;Amo los personajes con alas
no odio;mira en la caratula hay una prosti del gta
no odio;en realidad yo estoy hasta las manos pero niego mi amor recin me pregunto algo y yo nono trankii no pasa nada no seas cagooona
no odio;Yo xd
no odio;Ya lo hice, si sirvio Vote lo mismo que tu, no me falles
no odio;Aadira
no odio;Todas m pasan a mi
no odio;gracias
no odio;Holaaaaa
no odio;No me den corazn en Instagram stories porque por una muy extraa no me deja verlos
no odio;Hoy sale bad man
no odio;que se vaya a la verga
no odio;De lo que se perdi bobo hptaaa
no odio;Hello
no odio;La nueva de Batman tiene gatitos. Ya, de . Hahaha
no odio;que bonita vibra traigo, aprovchenme
no odio;Vinimos a este mundo para hacerte sufrir
no odio;ahora lo confirmo yo
no odio;mi gusto culposo? abrazar a mis amigos
no odio;Eso estara increble
no odio;necesito un morocho en mi vida
no odio;Ya vi otro
no odio;Gracias
no odio;Que cool se ven los globitos en mi perfil
no odio;yo dije todos iguales los ex's que tenemoss, no los hombresssss
no odio;Gracias
no odio;"Luego lo empiezo yo &gt;"
no odio;amo ver a mis amigos felices
no odio;:23 de la madrugada, una finca en la mierda, todo oscuro y a mis primos les da por hablar historias de de miedo
no odio;me escribes al ds Jodaaa
no odio;Gracias
no odio;Gracias
no odio;Pues el screen dice que vayas con otra a tu nombre y tu INE, igual y funciona
no odio;Feli
no odio;hoy tara, masuso
no odio;Que pena que uses esos emojis si
no odio;no s, no me arrepiento
no odio;Tengo que dejar de encularme de cada vato que me habla
no odio;Mi hermano ms de
no odio;sigo a personas esperando que me lo devuelvan, pero creo que no soy tan cool
no odio;que deli es no traer brasier
no odio;fuaaa una banda amigo, felicidades por este gran logro bro
no odio;Arceus, dame paciencia porque el da de hoy ya no ha comenzado bien
no odio;Acabo de retroceder a , Linkin Park de madrugada, cafecito y la tesis
no odio;Encontr a mi hermano, finalmente tengo un hermano -Feli
no odio;fav chocolate?
no odio;Ol, ol, , buenos das,
no odio;Yo a ti. Ya hay que vernos
no odio;ya se haban tardado los comentarios de mis familiares de que fui a la marcha a denigrar la imagen de la mujer
no odio;hola, como han estado?
no odio;Te mando uno
no odio;Soy esa persona que en pleno prefiere escuchar canciones de los 's 's que las actuales
no odio;Hasta maana
no odio;AAAA graciaas
no odio;Ya a mimir
no odio;Suerte en tu partido princesa
no odio;ya regres, todo sali bien
no odio;WCCP
no odio;qu tal si me voy, neta desaparezco, alch para no molestar a nadie
no odio;El que no opina igual, pues no me importa
no odio;amo que fati neri y yo nos comunicamos por telepata
no odio;nunca llueve as de fuerte y a esta hora pero ya ven, el da que voy a salir est lloviendo
no odio;Siento una paz que hace mucho no senta y se siente bien
no odio;yo estoy triste contigo de q tienes novio pero esta bien, quieres hacer videollamada en lo q decoro mis cuadernos?
no odio;Tengo casi veinte y sigo sin nada que hacer, si soy HBD ENTROPIA
no odio;"GRACIASS&lt;3 igual si de causalidad estoy en tw cuando alguien abra te digo"
no odio;Me desvelaria para ver el concierto pero me va caer muy pesado desveladas seguidas y adems el lunes tengo examen de math
no odio;Me puse a andar en la bicicleta de mi hermano y pude dar una vuelta sin caerme, toy feliz
no odio;yo: mi novio:yo:
no odio;"si baby, nos la pelaron &gt;"
no odio;"Se llama Imvu, es un ""juego"" (Ms como red social con motor grfico al que algunas veces voy con una amiga"
no odio;no ver el concierto hoy en la madrugada, me esperar hasta maana en el cine
no odio;Momentos inolvidables quedarn en tu memoria
no odio;Buenas noches
no odio;gracias !!
no odio;Que buen da
no odio;Hollaa
no odio;Si pudiera volverlo a hacer no cambiara nada
no odio;una caguama y un porrito es lo nico q necesito para ser feliz
no odio;Suerte en tu partido princesa
no odio;ltimo fin de semana y todos pasan de mi
no odio;Hola bonita
no odio;Hablarle de tus ataques de ansiedad y que los sepa comprender es lo ms top qu hay
no odio;ay bn lindo todo hoy
no odio;Ley de atraccin haz lo tuyo
no odio;Si, ya todo bien
no odio;A quin no le gusta perrear hasta el piso en su cuarto
no odio;Nos divertimos mucho vindola
no odio;,
no odio;ah bueno, chingo a mi madre jaja
no odio;Feli porque hasta pizza me regalaron
no odio;"Yay Felicidades &lt;3Espero que disfrutes tu da y cumplas muchos ms OwO"
no odio;Me estas volviendo loco
no odio;y sufrir en ranks
no odio;hola ?
no odio;Hasta aqu la historia Volvemos a la programacin habitual
no odio;Es nuevo que me sienta as? Claro que no
no odio;Tacos?!!, siempre una buena opcin
no odio;trajo flores y chocolates
no odio;Necesito un partner para ir al gym
no odio;Embeces la vida no es como queremos
no odio;"Cosas de piraas &gt;"
no odio;concert
no odio;maana devuelvo follow, ahora debo volver a dormir
no odio;si no te gusta volviendose rojo vete a la mierda
no odio;Quiero saber cmo ests .
no odio;noo mika no es por ah pero igual yo tambin
no odio;Voy a empezar a tomarme en serio esta cuenta
no odio;Ese desco K Movistar con Living Apps! }
no odio;Que hipcrita de tu parte llamarte madura y clavar el visto cuando quiero aclarar las cosas.
no odio;Ya estoy haciendo vidio sale en meses
no odio;Yo no quera que tu me contestaras las historia
no odio;Tengo un par de babys explotndome el cel y yo pensando en ti estoy a tu Merced
no odio;Yoo Se Cuando Yo Le Gusto a Una Tipa
no odio;bueno ahora si puedo decir que le gusto a hombres y a mujeres
no odio;Ahorita consigo
no odio;Podemos ser amigos de whats jajajajaj te amo y extrao
no odio;Cogido
no odio;hello
no odio;ya volv, me quers ver?
no odio;Ahh bueno ! Cudate mucho te voy a extraar!! See ya on Monday
no odio;Ubicacin porfavor
no odio;Mito
no odio;Se puede?
no odio;Muchas gracias
no odio;me gusta ducharme a las am con la luz apagada
no odio;lo vas a hacer genial
no odio;no quiero pensar mal pero me dan motivos para hacerlo
no odio;Qu chido
no odio;Acabo de recibir mi primera calificacin de la universidad, y me da mucha emocin haber sacado una buena nota, solo quera comentarlo
no odio;me odio
no odio;No estoy bien para nada, pero intentamos disfrutar
no odio;Buenas noches Adrin yo me voy a dormir
no odio;No entiendo tu odio, te falta Jess en tu vida.
no odio;Que hice mal, para no saber ahora lo que estoy haciendo o en lo que me met.
no odio;En billetes de monopolio entonces
no odio;miren centaurea, no se van a arrepentir
no odio;Ya me le seis veces la cardd del rol que quiero entrar y sigo as ? Basta maat, ms intil imposible
no odio;maana tengo un almuerzo
no odio;Yo creo que ver Spiderman nwh arreglar todo
no odio;manifestando para irnos a la playita juntos
no odio;Bingo
no odio;Le atinaste a
no odio;Buenas noches
no odio;La acabo de ver y me encanto!!! literal me hubiera redo como loca si no fueran las doce de la noche
no odio;Si, no te preocupes. Si las le es por eso que solo gastara si tuvieran que ver con los chicos.
no odio;Guapas
no odio;Buenas noches
no odio;Ah. So similar.
no odio;Gracias
no odio;No veo que a esa periodista la hayan matado como si pasa en el pas aprende jajaja
no odio;solo espero que llegue el fin de semana para ir al psiclogo
no odio;hola todo bn
no odio;/03 fue un buen da
no odio;Holi dilan, como estas?
no odio;Lo nuestro fue algo Efmero, pero Inefable
no odio;hola may
no odio;calladita m veo mas bonita entonce ::
no odio;Jaja f hubiera estado bueno los pero bueno se entiende
no odio;Sisi estoy bien
no odio;TODOS JUNTOS A LA MIERDA NOS MANDAN
no odio;Hoy me he redo muchsimo de verdad ha sido un momentito de felicidad maravilloso
no odio;Quiero morirme pero tampoco darle ese gusto a algunas personas que me odian
no odio;Seguir cuentas de teatros, o centros culturales, ya que ellxs tambin publican sus eventos.
no odio;"Te dedico ""Que fcil es amarte"""
no odio;Gracias, estimado Pablo! Que as sea
no odio;hello!!!
no odio;esta hermosa
no odio;es mi proceso y slo yo lo entiendo
no odio;El de fnaf me cost y el de tokyo revengers
no odio;muy amable la mujer del Cabify de esta maana, ojal ms personas as
no odio;te dirn que soy una infiel pero ya llego mi karma y te tocar la mejor versin de mi
no odio;bonita noche ! descansen, pasen bonito fin de semana.
no odio;Pues bonita
no odio;Contigo me olvid de lo malo que ah sido mi da
no odio;Nadie: Quien te saca una sonrisa en la escuela?Automticamente Yo: Sho misma
no odio;X: Me dice te veo ms linda al naturalMe: AMI ME VALE VERGA NO PEDI TU OPININ MAJE
no odio;Ya hermoso sbado hermosa Lups
no odio;La verdad debia meterse a nadar por que pag pesos de entrada verdad que estuvo bien?
no odio;estoy muy triste en serio JAJAJSJS
no odio;queda una semanita nomas
no odio;"Antes de dormir, una meta que tengo pendiente es estar en otro evento pero est vez de streamers &gt; as que a darle streams diarios"
no odio;Me gusto mucho Batman
no odio;A e s t h e t i c s
no odio;As v que remplazan a Yaser en Envigado, con los pelados de la cantera
no odio;Hay cosas que solo el tiempo las dice
no odio;No se si quieras
no odio;Te recomiendo que tengas a una persona como filtro para esos mensajes.
no odio;jugar con mi perrita es salir llena de rayones
no odio;listo, se fueron esas fotos
no odio;not me amigando con una chica de India en genshin
no odio;Ojala que en la siguiente cita con el gineclogo tenga buenos resultado
no odio;Palo te confundiste de cara y eso es muy carioso
no odio;me siguen en mi ig pls? soy /ibluelino
no odio;Vaya por Dios. Qu hemos roto,
no odio;No todo es serio mtetelo el la funcking cabeza
no odio;Empeza a cambiar tus actitudes de wachin y me vas a tener a tu lado otra vez
no odio;ya me di cuenta q no haras ni la mitad de las cosas que yo hara por ti
no odio;Grande neeko, muchas felicidades
no odio;En el buscador ya no habr ningn nombre y no visitaremos ningn muro, te lo prometo Karensita :
no odio;bueno hasta maana a la noche, cuiden a hazza mientras no estoy
no odio;Crea q el horizonte marino era una cada al vaco, a la nada...
no odio;Cuando quieras comer rico me avisas. estoy a la par. lo prometo!
no odio;Mentira, si las subo
no odio;valo
no odio;eso te pasa por comer sin mi
no odio;Hoy por primera vez en mi vida me tome L de birra yo solo Miexestariaorgulloso
no odio;Que semana tan rara, pero estoy muy orgullosa de mi
no odio;No q ya t ibas a dormir?
no odio;Con los pendejos no se pelea SE LES EXPONE, as que chala de cabeza
no odio;hello, dm po
no odio;hellooooo
no odio;a esperar entonces
no odio;Todos tenemos un lugar en el corazn de Dios. (
no odio;hola
no odio;al final todxs me hacen sentir mal, o yo soy muy sensible o mi ambiente es una mierda
no odio;yo en y soy igual
no odio;"But llega un c papu misterioso y te hace llegar a followers &gt;"
no odio;Crjo ojala maana todo salga como lo pense
no odio;Si los bloquee es por que me cagan
no odio;A mi me hablas feo y ya siento que no me quieres
no odio;Haciendo un proyecto
no odio;Bueno, espero que llegue pronto y pues aqu estoy por si necesitas algo
no odio;Mm... Botas o pantalones de camuflaje
no odio;lo pense pero eso sera maana
no odio;Nadams que salga una para ganarte en Beer otra vez
no odio;% posibilidades % fe, pero por cierto lindo cosplay en las anteriores
no odio;Listo espero que cumplas
no odio;jajdjd ya me vine a dar los sustos de medio noche
no odio;foo : d5eccdf-ca30-4d59-8547-9368db84d3a2
no odio;Pues ped unos taquitos
no odio;no, soy d Venezuela, eso lo dice todo...
no odio;Mi fondo de pantalla esta feo, mndame una foto tuya para ponerla
no odio;me parece q me sacaron el wifi
no odio;naaaa no le gana nadie a ella, es la chica ms linda que hay
no odio;[12/3 :53] Me rei mucho con vos[12/3 :53] Gracias por hacerme charlame voy a mimir feli
no odio;S soy, pues por ejemplo yo no s controlar el alcohol pero s la marihuana
no odio;A mi tampoco me gustan, pero ellos las amaron yo digo que por la muchachona ).
no odio;ok po
no odio;no supo aprovecharlo
no odio;ya m voy a mimir , bnas noches
no odio;Mmmjum si te quedo el saco, pontelo
no odio;perdon okey, ya me voy a dormir
no odio;Que as sea, Mariana. Muchas gracias por los buenos deseos
no odio;"graciaaaas por las calificaciones &lt;3 y verdaderamente te recomiendo las otras, tambin estn /10"
no odio;Ay estara bien cool
no odio;entregu minuto tarde la tarea y me falt un punto de anlisis, pero la intensin es la que cuenta
