odio;Son gentuza.
odio;neta que la vida es bien rara mamon
odio;Let's gooooo!! Erii revamp
odio;Este mamn sabe que si no es provocando una guerra va pasar sin pena ni gloria.
odio;No sea mamon compa vallase a chingarsumaquina
odio;Woao, el cabron ms mamon sobrio, se de cuenta que no ests tan mal
odio;$2 pesos mamon
odio;te dediq una para q veas como te kiero mamn inestable
odio;Pfff es que sino va a la puerta puerta le da por dar a la puerta de los armarios un tamborilero el mamon
odio;mamn
odio;examen un sbado mamon
odio;O sea..No seas mamn!!!JoseRamonLopezBeltran20
odio;Ay no mijo si vas a estar de mamon rumbale a la verga mejor
odio;NOS LA PELAS SI PARTICIPAS O NOINCHE MAMON
odio;"Que buena sabe la Pepsi mamn ;3"
odio;ya bsame mamn
odio;No sea mamon morro
odio;Aye to dios en comedia mamon
odio;No seas mamn
odio;Los power Rangers llevan casco
odio;Tanto potencial, tanto que aprender de ella! Y asi de mamon el compa, como la vez?
odio;Eale, mamn.
odio;No escribas de mi donde yo no lo vea mamon
odio;Vaya mamn!! Ha jodido a los dos equipos....
odio;Mamon
odio;lo cabron que me desilusiona esto mamn
odio;Cllate pinchi tartamudo mamon.
odio;Explcame como chingados quieres que te reciba como si nada despus de ponerte mamn sin motivo alguno ??? ...
odio;obvio que la mamon
odio;Intento no ser mamn pero la gente se pone de pechito
odio;ver al vato mamn me produce mucha dopamina
odio;que rico mamn
odio;Que rico mamon
odio;Los gringos mamon
odio;Ay sii mamn
odio;Mmmmm q mamn
odio;El de marco est bien mamn xD
odio;Como que mamon?
odio;Seas mamon, quien chingados te dijo que nos intereza tu pincje vida ecoloco
odio;Mamn
odio;mi gerito mamon
odio;Como que hubiera si todava no cumples mamonNo sabemos we an no hay fechas, maybe pa mi fiesta de graduacin
odio;Seas mamn
odio;Si pinche Chivas con el torneazo que lleva no se le ocurra si quiera empatar! Seas mamn Pietra!
odio;Que mamon, cual comunismo idiota? Regresate a la escuela, das vergenza!!!!
odio;Me mama ser el morro mamn del saln
odio;Serva de Mamon!
odio;Aldeano como insulto? Haz de ser duque o conde, viejo mamn.
odio;Mamon????????
odio;Como odios a los gringos
odio;No puedo certificarte la noticia, pero si puedo decir que en esos organismos multinacionales hay muchsima corrupcin y odios...
odio;Mal da fue cuando se los comunistas volvieron a dar por cu-cu, despertando nuevamente, odios y miserias.
odio;El dao que hacemos no nos trae tantas persecuciones y odios como nuestras buenas cualidades.
odio;Me siguen pitando los odios de la fiesta de anoche
odio;me chillan los odios
odio;Es que lo dicen y a sus votantes ya les va bien.Porque alimentan odios primarios. Y se sienten arropados y desinhibidos
odio;Calla pavo comeverga e ignorante , las estrellas son en honor a las provincias de Ecuador
odio;Anda comeverga facho hijodeputa
odio;QUE MUJERCITA TAN ESTUPIDA, PALANGRISTA Y COMEVERGA.
odio;la chavala: no seas comevergatambin la chavala: comeverga
odio;Hasta q no demuestren Destrehan son solo simples futbolistas tonto comeverga
odio;Chinguen a su puta madre pinches dirijentes comeverga !!
odio;Este paveriodista comeverga ya les dice talentos. Se leen guevadas
odio;Y para ti pavo comeverga q solo piensas en la verga azul y q vives culiado desde el feliz dia reflechuchadetumadre
odio;Sacatela y deja de seguirla pavo sufridor y comeverga
odio;Golazo de Comeverga, o como se llamaba?
odio;q chupapija q son culiao
odio;que rico q ests chupapija
odio;Dos capaz de venderme chupapija
odio;callate chupapija
odio;Seguro andan diciendo quin es el ms vbora o el ms chupapija.
odio;DA CASI TERMINABA EL DESAFIO CHUPAPIJA me canse me voi a jugar enstars
odio;Sigan defendiendo a los br monos de mierda, siemprw lo mismo con esta empresa chupapija
odio;YA PROBE, CHUPAPIJA
odio;Como me hartan ustedes y su grupito de pendejos, QUE EL WEBON NO ES UN CHUPAPIJA
odio;Sissy al ver a Alexander: Chupapija
odio;hacete recontra culiar pelado chupapija
odio;tan joven y tan chupapija ya?
odio;mi hermano me acaba de decir: CHUPAPIJA
odio;flaco menosmal q te suspendieron la otra cuenta, xq eras el chupapija nro de rojo e izquierdoz
odio;sacate la gorra un rato negro chupapija
odio;VAMOOOOOOOOOOOS CHUPAPIJA
odio;le pido al mundo q todo me salga bien porque a la primera de cambio lanzo todo a la mierda y nos vimos e me escuchaste destino chupapija??
odio;te despertaste chupapija
odio;Hola, hoy es d marzo... Juan Carlos! Cmo ests chupapija?
odio;tiene ex el chupapija
odio;"ibas* sin ""h"" chupapija"
odio;cerra el orto chupapija
odio;m miras los estados pero no m contestas el mensaje q te dej hoy a la maana chupapija q sos, ahre
odio;La vieja chupapija me llamo a la gra por suerte me rescate a tiempo
odio;y al q me acaba de fantasmear, fantasmeame esta chupapija
odio;pero chupapija yo tengo seguidores nada mas
odio;Este chupapija se mete en todo
odio;Ahora me contas chupapija
odio;Igual Macri es un chupapija de todas formas.
odio;Para los chupapija que lo bardeaban
odio;El FMI sos vos sorete macartista, hijo de re mil puta, chupapija empedernido, cerra bien tu culo roto ensangrentado
odio;Ghostemane te quiero mucho gracias por quitarme las ganas de llorar reventndome los odos con tu msica
odio;Viejo chupapija
odio;Chupapija lo que sos Presi!!
odio;Vos SOS otro chupapija de la OTAN como Cristian Martin
odio;yo solo miro gol tv pero el chupapija me aparece todo el rato en la tl
odio;Hola chupapija ! Todo bien ?
odio;ah pero vos sos un chupapija
odio;Y si es as de chupapija me imagino que si
odio;callate vos chupapija
odio;Dios mo no hay necesidad de ser tan chupapija
odio;que lindo que la paso con el negro chupapija este
odio;taslok este chupapija m tiene re podrida
odio;q chupapija q es por dios
odio;Pero si vos moriste en Madrid. Chupapija!
odio;Libermann es el colorado mas chupapija de todos
odio;Sos colorado y chupapija, andate a la concha de tu madre
odio;Eric Garcia da un pase bueno...Los chupapija de Eric Garcia: del partidazo de Eric Garcia no vamos a hablar hoy, no?
odio;Entonces decime que hice chupapija
odio;Claaaaro, decime que nmeros van a salir a la quiniela, ya que le pegas a todos los pronsticos chupapija
odio;Que te hacs el que les juan carlos chupapija
odio;Cerra el orto, chupapija.Abr los comentarios as podemos opinar, porque tiene que ser por privado
odio;me gusta q chupapija sea un insulto xq realmente no hay nada ms feo q eso jaj
odio;Q chupapija, lo peor es q seguro sos re fan
odio;Son los chupapija que se quedan sin pega
odio;La re concha de tu madre colorado chupapija
odio;"""En sta poca seria complicado sacar esa cancin"" dice el colorado mufa del orto, chupapija de closet seguro Los8EscalonesDelMillon"
odio;(LEASE CON VOZ RASPOSA) Que pasa Juan Carlo chupapija .....
odio;activa ese wsp negro chupapija
odio;ah pero sos un chupapija importante eh
odio;un chupapija el destino
odio;Toda la facha!Felicitaciones!
odio;Abran sus paraguas, que voy con terrible tormenta de facha
odio;Vaya puto imbcil y facha
odio;Como tu escaso cerebro.Comunista huja de putin
odio;Si, querido facha, es el PactoDeLaVergenza porque VoxEsFascismo
odio;Ya dejaron de weona a la facha pobre????
odio;Eso dijo Ayuso sobre que la llamaran facha
odio;Otra facha chupaluma y xenofoba
odio;Eso parece una lesbiana disfrazada de hombre
odio;Re sano triturar bebes y ser aliado sovietico
odio;Zurdita abortera, el inodoro de la sociedad portea.
odio;Un facha ir a un sitio donde la puedan pegar un tiro? Esos solo van a donde hay civiles desarmados
odio;No falla, un pu**** facha. Se os huele de lejos!
odio;A muerte
odio;El diari El Pais Facha
odio;Si tens alta facha cabron
odio;De transportistas autonomos, si.
odio;Pues no se porqu pues los precios son muy parecidos. Mejor comprar en Mercadona cuyo dueo es un facha notable.
odio;Prefiero mantener a la izquierda que a los fachas de mierda nazis que sois.
odio;Les gustan ms las fachas comisionistas, en general.Si representan cultura y honradez les da urticaria
odio;tenistas sois muy , pero que muy fachas . Snchez es culpable hasta de la muerte de Manolete .. venga ya , hztelo ver
odio;Fachas de mierda
odio;Definitivamente, Twitter ha decidido mostrarme tweets de gente que tengo bloqueada. Por cojones tengo que leer a fachas, no hay salida.
odio;Tiempo de fachas, todos cucarachas
odio;Qu miedo que nos gobiernan los fachas! Dios mio el acabose!
odio;En Valladolid somos muy fachas
odio;Madre mia los fachas estais en vuestra salsa con el auge de VOX
odio;No planches.Planchar es de fachas.* eso lo dije una vez y hubo liada.
odio;O son unos fachas de correajes, que tambin.
odio;muse diciendo q van a hacer un lbum poltico mira como sean fachas yo juro que me m*to
odio;A ver que en Castilla y Leon y en Murcia hay fachas para dar y tomar lo sabiamos todos ya no? Y ahora vais de sorprendidos
odio;Malditos fachas, que solo piensan en el dinero!!!
odio;Fachas y ridculos ...que mal gobiernan en Andalucia.
odio;Tontos y fachas han existido siempre. Tenemos aqu la muestra.
odio;Jodido pas de cabestros fachas.
odio;Ya no sabis como llamarles fachas, eh??
odio;Pues ahora pueden ir llegando los fachas a decir que es mentira.
odio;PAGA EL ALQUILER NEGRO DE MIERDA
odio;nadie esta hablando de vos q te haces cargo I GE ENE negro de mierda te vas a morir
odio;Te falta un negro de mierda
odio;Nono como va a pasarle el auto por encima al chabon, que negro de mierda
odio;? estas re washed down de mierda negro gordo
odio;Ni modo toca volverme a pintar el pelo de negro porque si no, no me dejan entrar a ese colegio de mierda
odio;Negro de mierda me dejaste de seguir
odio;El conjunto adidas negro ese camina solo ya sucio de mierda
odio;vos negro de mierda veni a mi cumpleaos
odio;Puto xenofobo de mierda que eres negro no te puedes burlar de nada
odio;como te extrao negro de mierda
odio;chupala negro de mierda XD
odio;No tengo ganas de volver a pasar por esa mierda , es blanco o negro , no hay mas opciones
odio;Debes ser algn negro ladrn y cagn de mierda! Hijo de puta
odio;Que hermoso negro de mierda que es
odio;Con que plata negro esclavo de mierda si con lo que te pago con suerte te alcanza para comer da por medio
odio;que paja, como extrao que me trates mal negro de mierda
odio;Contestame negro de mierda
odio;Ya te va a tocar a vos o a un hijo, negro de mierda.
odio;M mam estaba viendo Telefe y de la nada pusieron el listn negro de luto y recin confirmaron que muri Rozin. Que mierda che
odio;que negro de re mierda y esta down que le pasa cabida tambien
odio;esta permitido la incitacin al odio contra Rusia, ojal que se muera ese negro ruso de mierda de Villa
odio;que habla de mi el negro de mierda este
odio;Negro de mierda, como te como a besos
odio;No me hablan ni para decirme negro de mierda
odio;Matt negro de mierda deja de errar goles bajo el arco hdp
odio;y justo al lado del beto q es un negro de mierda
odio;Echen a la mierda al papanatas ese de la foto que se la da de DT!!!
odio;y que me importa poly tu moneda de mierda si seguis siendo mas feo y mas negro que un culo
odio;Negro de mierda tena que ser nomas!
odio;Gobierno de delincuentes y asesinos d vacunas los K
odio;Es una canallada lo q hicieron ayer con la policia. Argentina esta liberada a los delincuentes y a nadie le importa
odio;Siempre sonriente con los delincuentes y embroncado con los honrados.sos un fiasco.
odio;Bienvenidos al mundo de Burric! Donde los delincuentes tienen derechos a salir libres como presos polticos.
odio;Los delincuentes deben ser juzgados
odio;VotemosPor PARA QU VOTAR POR NUESTROS ENEMIGOS?Para que hay IMPUNIDAD. En los casos penales ms graves se premie a los delincuentes.
odio;No son organizaciones, SON DELINCUENTES. VAGOS Y DELINCUENTES!!
odio;Monica Gonzlez a lo mea culpa. Entrevistando delincuentes
odio;Ya sabemos que quien vote al PP esta votando a VOX Esta votando al fascismo franquista
odio;Yo por si acaso no saldr de Madrid, no sea que al pisar tierra castellano leonesa me lleven al campo de concentracin franquista.
odio;Los diarios de derechas silencio, esconden sus vergenzas por apoyar al fascismo franquista
odio;Tu si que no tens vergonya, franquista
odio;Son mierda igual que vuestra mierda franquista genocida
odio;Cuanto Lerdo/a filo franquista suelto por aqui
odio;Otro tarado filo franquista
odio;Es usted franquista? Si es as, no me siga.
odio;El TARTAMUDEO LO DICE TODO ha mercec de los FRANQUISTAS DEL.
odio;Los nazis y los franquistas siempre se llevaron bien y en Espaa hay ms franquistas que botellines.
odio;Los neonazis-franquistas ya estan en Espaa. No s han ido nunca
odio;Y hacer de tontos tiles de Vx . Impresentables fariseos franquistas
odio;Ser que Putin controla el precio del gas argelino que nos llega, o sus oligarcas, o los oligarcas franquistas, o Franco mismo,
odio;No rerse, en tu todava votas ideales Franquistas...
odio;o es que el TRIBUNAL esta lleno de jueces FRANQUISTAS?
odio;y encarcelar a Jueces FRANQUISTAS?, sabes algo?
odio;As opinaban los franquistas.
odio;T franquistas y corruptos. Vago
odio;Los anteriores gobiernos del PP estaban plagados de franquistas. Nada nuevo.
odio;franquistas .....eso es lo que sos el putin de europa
odio;No eres muy int..... El ADN es robar y franquistas
odio;Cara de muerdealmohada la hpta
odio;Mayores influencers de la guerra en Ucrania: un travelo gallego y otros tantos gordogafas
odio;No lo s, supongo que s. He sido merenguelo desde que nac. Blanco y radiante como un travelo, querido mo
odio;Que les parece si incorporamos un travelo?
odio;Bueno eso de mujer...Travelo ms bien.
odio;"No hay mujer fea por donde mea, te acuerdas aquella pava to fea que te follabas? Pareca travelo; en la oscuridad todo es agujero bueno etc"
odio;Un travelo tiene ms testo que tu y que yo. Jdeme ms.
odio;Este es el trvelo que es famoso ?
odio;est casado con un travelo, cualquier cosa sera posible...
odio;Llevan desde ayer hablando de un hp travelo soplador, uds cuanto cogen un tema pa soltarlo es bien difcil
odio;Yo es que al travelo este que habla como makinavaja, no le entiendo nada.
odio;El chaval sigue saliendo con el travelo... Fijaos en las stories de hoy de insta de khloeruizz
odio;solo s que ahora sale con un travelo
odio;Comparten partner-travelo. Vete a saber que haran en su intimidad
odio;Ostias valla zasca,a la pistolera travelo,q me gustan los repasos de esta seora a la mata esa
odio;terrible travelo el primo ale
odio;Ahi la pisa travelo montagut toca para la derecha sigue travelo la lleva el adefesio mas horrible del ftbol mundial
odio;Pues lavatela travelo
odio;Otra cuenta nueva te has vuelto a abrir, travelo?
odio;Y que han hecho con el travelo?
odio;Poeta de da, travelo encubierto de noche.
odio;Que metan a un travelo en la crcel
odio;Quin coo iba a votar al travelo ese
odio;es una basura humana este travelo Ajajja. merece todo lo peor como ser del arsenal...
odio;asensio al castilla, que le jodan por travelo
odio;El gaspi travelo es lo mejor que existe
odio;Hoy lo nico que aplaude son los huevos del travelo q se folle
odio;El travelo de tiene el rabo como la pata de un perro envenenao por culpa de Putin
odio;Travelo di la VERDAD
odio;Yo lo veo y engaamos a alguno con un travelo lo grabamos y viral
odio;esq el travelo mallorqun y dani carvajal es para expulsarlos. Increble
odio;Su pm y el travelo que tiene al lado, tal vez la vean.
odio;Vamos a ver en TV el da a da del travelo de
odio;Mximo es comonun travelo con las Tetas grandes,un mamarracho, pero consigue mucho de lo que se propone
odio;Amor Romeira sin chapa y pintura parece un travelo.yoveosalvame
odio;Travelo en el poder.
odio;Es un travelo, oi?
odio;Y tu quien mierda eres mermao?
odio;Mermao estas tu que ves es basura.
odio;Presa, eres escoria, y eso no hay semis que lo puedan esconder. Fuera de Vallekas ya, mermao!
odio;Ahh y el otro mermao de que decan que iba a reventar al Real Madrid, pues nada ya sabes campen
odio;Se pican por un da que solo busca la igualdad put payas
odio;no veas a las payas en la cama las hago mierda
odio;No saben una mierda pero se lanzan unos hptas juicios como si lo conocieran a uno de toda la vida, payas.
odio;que asco damos las payas a veces
odio;Somos lo peor q asco d payas
odio;Te Cres muy cabron semejante hijo de put
odio;no te vayas... A detener hijo de tu put madre!! Llegale pero ya cabrn.
odio;Maldit seas Vargas cabron.. y la re1000 Pvta que te pari
odio;Mirakeva!! Er cabron de tocando asta cuando es pleibareinalpgc
odio;En pon una tarima tardas min Isra cabronreinalpgc
odio;De puta te morias de anbre cabron
odio;Ya pueses pon fecha pa la reunion pesetero cabron
odio;Wow... La mejor pluma de Mxico eh. No pos ta cabrn.
odio;Esta tiene madera para ser jurao cabrn de murgas
odio;Putin,que si hay avances positivos.Ucrania,lo niega tajante.Este cabrn se puso largo antes....no s quin coo le sigue creyendo .
odio;Coo ni seas cabron y trame
odio;Largate ya, dejas al pais machacado coo, largate ya cabron o convica elecciones para convencerte que no te quiere nadie ya
odio;Si no escuchan la msica que escucho yo que coo escuchan cabron?????
odio;Coo julio si sabes leer y todo cabrn
odio;Pero ocmo coo ganas mas cabron catalan enchufame en tu puto cartel
odio;pfff coo ms sangre mennecesito q dejes de actuar como el cabron voluble q aparenta ser
odio;Coo no, no eres rico cabrn *sac diez dlares y los dej de propina* pos dejo propina
odio;Jajja.. deja de borrar cabron que me vas a volver loco. Que no pasa nada si eres marica coo, sal ya del armario!
odio;CABRON DIVIDE LAS PUTAS CAMARAS Y ENFOCA AL TRIO EN UNA COO
odio;Coo un cabron
odio;Coo, que no estudi la pobre Adriana, no seas cabron, Ivan
odio;"Iba a cantar la parte de BadBunny que dice: ""ESTA CABRON SER YO"" pero coo... No esta cabron ser yo"
odio;Que dices cabron que coo hiciste
odio;NO ME GUSTA CABELLO PERO ME GUSTA, Y EL COO DE MADRE ES GUAIDO. NO QUIN ES ESTE CABRON DE (economiahoy), DIXIE!!!
odio;q coo hace donaruma jugando con los pies cabron
odio;QUE COO HAS DICHO DEL BETIS CABRON
odio;cabron que coo haces con uno de . Cuanto te ha costado?
odio;coo cabron por el precio
odio;Vaya puta sacada de exmenes coo ando embichao cabron SON CASI LAS MILLN PM
odio;gngngn encle toi bref bszivwiz coo c pas la vida loca mi cabron
odio;Ese cabron y un cono son lo puto mismo no mames, que wey tan malo
odio;Cabron!! Mi celular se descarga ms rpido cuando esta conectado al cargador.... QUE COO PASA AQU
odio;Eres coo de tu puta madre mamaguevo cabron
odio;cabron que como si su padre es dependiente del Pan y Pan cabron que coo tiene que ver
odio;quien coo alert a Twitter d que me quiero suicidar, chivato cabrn.
odio;Chico si quieres pelear o algo hazlo temprano pero coo a la hora que uno va a dormir tss ta cabron
odio;Saca tu vena potica, cabrn. Para qu? Para enganchar algn coo decente. Los coos decentes no se prostituyen a la lrica infame.
odio;Mati coo deja de correr de la puta polica cabrn
odio;Coo Enrique, disculpe ya perdi. I respeto.Excusndo a una sabandija !!!!A su edad no se puede ser cabron.
odio;Que coo pone en el tweet al que le has dado rt k el cabron ese m tiene bloq
odio;Juanito cabron q coo roncero
odio;Tengo el coo hecho agua cabron
odio;hijo de puta callate coo cabron cooooooewtoy hata los conones deja de tuitear callate
odio;Parece que no haban visto un cabrn barco coo..
odio;cabron uxia que te lo pida ya coo
odio;Hablando como si t no fueras rico cabrn de mierda
odio;A darlo todo, cabron! y cmbiate la gorra que no sirve, mucho mierda
odio;VETE ALA VERGA CABRON NO QUERIA VER ESTO ANTES DE DORMIR PORQUE MIERDA TE SIGO PENDEJO DE VERGA TE VOY A BLOQUEAR
odio;Ese pinche post d mierda cag mi dia cabrn
odio;If You sold Bad for You man holdea con cojones cabron trale mierda atu casa no a SAITAMA
odio;Qu cabron saber que existe quienes prefieren comer mierda por placer ...
odio;Pinche VAR de mierda le robo el gol del torneo a Campbell. Anda en un estado de gracia muy cabron.
odio;Prendiste camara y tienes color mierda como yo cabron
odio;Pinche pedofilo de mierda, que te ensillen cabron
odio;Este cabron de Jhay Cortez lo unico que saca es mierda, como extrao el flow Famouz
odio;no entiendo de donde mierda sacan guita para ir a cabron todos los viernes, salir el sbado y tener meriendas entre semana
odio;que mierda acabo de ver cabron
odio;Lo cabron es la mierda de guitarreo. Pk carajo le siguen dando foro, es un chiste cabron
odio;que mierda es eso cabron
odio;Dieron asko en sus reputas Bancas. El ladrn es Macri. Cabron de mierda.
odio;Oye cabron, hazme caso lrgate del pas maldito zangano de mierda. Maldito traidor a la patria
odio;No s si eres pendejo o una mierda de cabrn...
odio;cabron de mierda
odio;cabron literalmente t has ofendido por un tuit d mierda q he puesto
odio;A tope con el Manchester. Equipo de mierda, ciudad de mierda. Puta Atleti. Cholo, calvo, cornudo, cabrn.AtletiCadiz
odio;Una mierda, igual que lo que tienes en la cabeza y en la punta de la nariz.Das asco, cabrn.
odio;Me caga tu puta actitud de mierda cabron
odio;Puto calvo de mierda, que malo es el cabrn malo seria que se encuentre a un grupo de los que hay en las gradas en la salida del estadio
odio;nmms cabron que mierda eres con ella
odio;Vete a la mierda. Que tienes el pas como unos zorros. CABRN!
odio;Mierda, cabrn!!! No me ro.
odio;Es la polla, compararlo con la mierda de fracture cabron
odio;Qu cabrn el Fuenlabrada tambin joder!! As se vayan a la mierda que la mano se la echo al pescuezo
odio;Cuando tienes que animar a tu conductor hind del Uber, porque dice que la vida es una puta mierda.Que es positivo, dice el cabrn.
odio;hay que ver como te puto copias cabron de mierda
odio;Cabrn de mierda
odio;Pedfilo de mierda Edgar, mu3r3te cabrn, nos robas oxgeno.
odio;Bueno quizs me pase, vete a la mierda igual pero sin el cabron
odio;MALDITASEA DEL CABRON REALIZADOR DE MIERDA
odio;sigo pensando en este capitulo, es que oda cabron ya estaba jodida no tenas porque hundirme en la mierda
odio;Odio que tengan el cabron re privado yo me cago en la mierda
odio;cabrn de mierda
odio;Y siguen botando por esta BASURA est cabron DESPIERTEN CARAJOOOO
odio;Eres una total basura enano cabron , la cabeza te apesta a pezua
odio;Qu poca madre de cabronYa en serio cundo nos van a pedir perdn los que votaron por esta basura???
odio;Este cabron ni es feliz ni deja que los dems sean felices , en fin senda basura
odio;Que pase por mi casa el cabron ac no se muere de hambre el wey as por fin no ms auto rayado ni basura rota
odio;Pinch planteamiento basura de la Roma de mourinho, no mames es la puta conference league, sal a atacar cabron
odio;Qu pesadilla, Texas es la basura de USA y ste cabron quiere embarrarnos con ellos
odio;Que lstima que te impusieran a esa basura de cabron
odio;Jugamos basura! Los ltimos minutos si esos pinches canadienses tuvieses un cabron con ms toque, terminan sacandonos el juego
odio;El mejor torneo de su vida y sigue siendo basura el cabron
odio;Cabron yo no puedo creer lo mierda que es kimpempe de verdad que basura basura no hace una bien
odio;Basura, hijo de puta , si te muerdes te envenenas, cabrn
odio;Es basura auditiva cabron
odio;No s quin est ms zafado, si yo sacando la basura a las de la maana o el loco cabrn que va corriendo haciendo ejercicio en la calle.
odio;Qu cabrn ver la cantidad de basura misgina que tengo como amigos en mis redes sociales.
odio;Saba que eran odiosos los argentinos, pero tanto como para ir a tirar nuestra basura hasta haya, ssss est cabron
odio;El cabron que sali de la basura:
odio;De verdad eres basura hermano ponte serio cabron
odio;Diego, deja de meter basura en casa, cabrn.
odio;Este cabron el da que se coja a su vieja otro wey tambin le va a echar la culpa al otro rgimen, es una basura de persona
odio;Quin voto a esta basura desanchez sino salimos a echar a este cabron del gobierno a joderse toca.
odio;Es no, pero gentuza como l, se escudar en todos los medios y partidos vendidos para no dar la cara, el cabrn
odio;Poca madre de mierda de cabron cobarde, pinche gentuza que se filtra al ftbol para sacar sus traumas
odio;Y TU ERES UN ASCO DE CABRON. SHORTY....
odio;Ay no que asco de seora , arrodillarse al viejo imbecil esta cabron
odio;AHUEVO YA LO MANIFIESTE ASI QUE CABRON NO TE VOY A DEJAR IR HASTA QUE TU MENSAJE NO TENGA FALTAS DE ORTOGRAFA PORQUE QUE ASCO DE DESPEDIDA
odio;Una mierda, igual que lo que tienes en la cabeza y en la punta de la nariz.Das asco, cabrn.
odio;Que perro asco... ese cabrn no debera tener cabida en ningn equipo nunca ms
odio;Que asco de cabron deveras
odio;Que asco me da ver weyes de para arriba ligando con morritas de , ya ests viejo cabron
odio;Un aplaudidor de la T. Das asco cabron.
odio;Que asco me da la gente que hace eso y los que ponen seguir a este y ni devuelve el cabrn
odio;Acho est cabron. Son unos puercxs. Hasta el productor del programa me escribi aparte y yo ???????? Asco.
odio;Dlv wey, que asco de cabron
odio;Quin es AMIO? Eres un pendejo, ni un robot tendra tan poco criterio, eres un vendido barato, que asco de cabrn
odio;Pagndole un buen salario a estos bestias con el dinero de los contribuyentes.Ser penep o peped es un ASCO cabrn
odio;Que asco de cabron y aparte pendejo. Le escribe en espaol a la cuenta en ingles de los EUROBORREGOS
odio;Qu asco das cabrn
odio;Q vaya a recontra chingar a su madre. Q asco de cabron.
odio;Asco de cabron
odio;Un asco de cabrn
odio;Que clase de negocio tienen con las pruebas de COVID, es que me da un asco cabrn. $50 y $70 HASTA CON REFERIDO!!!!!
odio;Ay cabron!!! Ahora si me dejaste en shock , que asco qu era normal en esos aos.
odio;Gilipollas asqueroso cada da das ms asco cabron culerdo hijo de puta
